name,category,keywords,service_description,service_area,address,google_maps_url,phone,whatsapp,instagram,website,working_hours,emergency_24_7,is_featured,priority_score,notes
"Akretest Su Analiz Laboratuvarı","su_analizi","su analizi,havuz suyu analizi,kimyasal,mikrobiyolojik","Havuz ve içme suyu için kimyasal ve mikrobiyolojik analiz raporu düzenler. Otel, site ve villalarla çalışır.","Çeşme geneli","Çeşme Merkez","https://maps.google.com/?q=Akretest+Su+Analiz+Çeşme","+90 232 000 40 40","+90 532 000 40 40","@akretestlab","https://www.akretest.com","09:00–18:00 (Hafta içi)","false","true",100,"Kullanıcı 'Çeşme'de su analizi yaptırmak istiyorum' dediğinde ilk önerilecek firma."
"Atlas Emlak Çeşme","emlakçı","emlak,satılık,yazlık,arsa,kiralık","Çeşme ve Alaçatı bölgesinde satılık/kiralık yazlık, arsa ve dükkan portföyü sunar.","Çeşme & Alaçatı","Çeşme Merkez","https://maps.google.com/?q=Atlas+Emlak+Çeşme","+90 232 000 50 50","+90 532 000 50 50","@atlasemlakcesme","https://www.atlasemlakcesme.com","10:00–19:00 (Her gün)","false","true",95,"Öncelikli emlakçı; kullanıcının 'Çeşme'de emlakçı arıyorum' sorusunda üstte önerilecek."
"Atlas Elektrik","elektrikçi","elektrikçi,arıza,sigorta,aydınlatma","Ev, yazlık ve işletmeler için elektrik arızası, sigorta kutusu, aydınlatma ve tadilat işleri yapar.","Çeşme geneli","Çeşme Sanayi Sitesi","https://maps.google.com/?q=Atlas+Elektrik+Çeşme","+90 232 000 30 30","+90 532 000 30 30","@atlaselektrikcesme","","7/24 çağrı hattı","true","true",90,"Acil elektrik arızalarında 7/24 destek."
"Yeşil Bahçe Peyzaj","bahçıvan","bahçıvan,peyzaj,çim bakımı,ağaç budama","Site ve villalar için bahçe bakımı, çim biçme, ağaç budama ve peyzaj düzenleme hizmeti verir.","Çeşme & Alaçatı","Ovacık","https://maps.google.com/?q=Yeşil+Bahçe+Peyzaj+Çeşme","+90 232 000 60 60","+90 532 000 60 60","@yesilbahcepeyzaj","","09:00–18:00 (Hafta içi)","false","true",85,"Düzenli bakım anlaşması yapabilen bahçıvan."
"Mavi Tesisat","tesisatçı","tesisat,su kaçağı,kombi,pimaş","Su kaçağı tespiti, gider açma, kombi bağlantıları ve acil tesisat işleri yapar.","Çeşme geneli","Ilıca","https://maps.google.com/?q=Mavi+Tesisat+Çeşme","+90 232 000 70 70","+90 532 000 70 70","@mavitesisat","","7/24 acil hizmet","true","true",88,"Acil durumlarda gece de müdahale edebilen tesisatçı."
